### ISSUE TITLE
GitHub release based repository is difficult to mirror

### ISSUE THREAD

**Issue by push0ret** [demizer/archzfs#621]
Hello!

I have a requirement to maintain local mirrors of repositories because my servers do not have outbound internet connectivity.
This is typically a trivial task with upstream mirrors supporting the rsync protocol, however I'm a bit puzzled by how difficult this appears to be for the current github releases based archzfs repository.
The old archzfs.com/archzfs repo supports rsync:// mirroring nicely.

With the github repository, it looks like I need to curl the archzfs.db (--follow the 302), fetch the db, extract it, read the metadata to find out which packages exist, then fetch each individually (again hopping a 302 for each).

I understand that maintaining a repository takes effort and that the github release solution is likely simpler to maintain.
If there's something I could help with to keep the rsync compatible repository alive, please let me know.

Thanks,
Fabian

**Comment by andrei-korshikov** [comment]
> I intend to keep the `mirrors.uni-plovdiv.net` one running, including the rsync functionality, which is provided for the Arch mirror residing there anyway.

👍

@kerberizer What do you think about (partially?) resurrecting https://archzfs.com/archive_archzfs/ on https://mirrors.uni-plovdiv.net?

A question about archive was asked by @fermino in https://github.com/archzfs/archzfs/issues/599#issuecomment-3138426203, but there were no answers.

Official Arch Linux mirrors keep 3 last monthly ISOs, see e.g. https://mirror.pkgbuild.com/iso/, so keeping at least last 4 months of ArchZFS builds seems reasonable.

**Comment by kerberizer** [comment]
> I've set up https://mirrors.uni-plovdiv.net/archzfs/ as both a HTTPS and an rsync mirror. Please try it, e.g. `rsync mirrors.uni-plovdiv.net::archzfs/experimental/`. I've downloaded the release assets with a fairly simple Bash script that uses just curl and jq (gotta admit that I asked ChatGPT to write the basis to save a few minutes):

FWIW, the GH rate limits for unauthenticated requests are apparently quite low, so using GH CLI might in the end be the better option -- and it is, indeed, much easier too: `gh release download experimental -R archzfs/archzfs`.

**Comment by andrei-korshikov** [comment]
> I intend to keep the mirrors.uni-plovdiv.net one running

I added
```
Server = https://mirrors.uni-plovdiv.net/archzfs/experimental
```
 to https://wiki.archlinux.org/title/Unofficial_user_repositories#ArchZFS.

**Comment by push0ret** [comment]
Hi @kerberizer 

Sorry for responding so late and big thank you for setting up a mirror.
The HTTP mirror works great, however it seems like your firewall is dropping the SYNs to port 873. See below tcpdump:
```
22:59:02.483235 IP 10.0.2.11.48892 > 195.230.127.9.873: Flags [S], seq 2324142457, win 64240, options [mss 1460,sackOK,TS val 153904100 ecr 0,nop,wscale 9], length 0
22:59:03.509563 IP 10.0.2.11.48892 > 195.230.127.9.873: Flags [S], seq 2324142457, win 64240, options [mss 1460,sackOK,TS val 153905126 ecr 0,nop,wscale 9], length 0
22:59:04.522883 IP 10.0.2.11.48892 > 195.230.127.9.873: Flags [S], seq 2324142457, win 64240, options [mss 1460,sackOK,TS val 153906140 ecr 0,nop,wscale 9], length 0
```

**Comment by push0ret** [comment]
> Hi [@kerberizer](https://github.com/kerberizer)
> 
> Sorry for responding so late and big thank you for setting up a mirror. The HTTP mirror works great, however it seems like your firewall is dropping the SYNs to port 873.
> 

Nevermind, it does work now. It's likely that the issue was on my side. Sorry.
